{
  "schema_version": "vista.playable-action-catalog/v3",
  "catalog_id": "vista_indoor_actions",
  "catalog_revision": "vista_indoor_actions_r3",
  "source_catalog_binding": {
    "schema_version": "vista.playable-action-catalog/v2",
    "catalog_id": "vista_indoor_actions",
    "catalog_revision": "vista_indoor_actions_r2",
    "content_digest": "07eb0a4740ea214c15fa59504b0b923787c23fa0b9232adfc18a0efc0cec7e35"
  },
  "candidate_animation_sources": [
    {
      "source_id": "makehuman_cc0_r8",
      "profile_schema_version": "vista.makehuman-cc0-animation-profile/v1",
      "profile_id": "makehuman_cc0_animation_vertical_slice_r1",
      "content_digest": "3a596cb3088f1e2439b70c5c3c099e6ecbc521c7658af7eb52804fe5811654f2",
      "acceptance_state": "candidate_unaccepted",
      "action_ids": ["idle", "walk", "jog", "sprint", "pick_up", "place"]
    },
    {
      "source_id": "makehuman_cc0_r14",
      "profile_schema_version": "vista.makehuman-cc0-detail-actions-profile/v1",
      "profile_id": "makehuman_cc0_detail_actions_r14",
      "content_digest": "eccf9da1ca7283efc08cffabe1d52ba020578e3d7c04d423cb2356f25b320d43",
      "acceptance_state": "candidate_unaccepted",
      "action_ids": ["inspect", "articulation.open", "close"]
    }
  ],
  "actions": [
    {"action_id":"idle","source_action_id":"idle","native_definition":null,"readiness":{"backend":{"status":"candidate","evidence_digest":null},"animation":{"status":"candidate","evidence_digest":null},"object_state":{"status":"not_applicable","evidence_digest":null},"event_mapping":{"status":"blocked","evidence_digest":null},"runtime_acceptance":{"status":"blocked","evidence_digest":null}}},
    {"action_id":"walk","source_action_id":"walk","native_definition":null,"readiness":{"backend":{"status":"candidate","evidence_digest":null},"animation":{"status":"candidate","evidence_digest":null},"object_state":{"status":"not_applicable","evidence_digest":null},"event_mapping":{"status":"candidate","evidence_digest":null},"runtime_acceptance":{"status":"blocked","evidence_digest":null}}},
    {"action_id":"jog","source_action_id":"jog","native_definition":null,"readiness":{"backend":{"status":"candidate","evidence_digest":null},"animation":{"status":"candidate","evidence_digest":null},"object_state":{"status":"not_applicable","evidence_digest":null},"event_mapping":{"status":"blocked","evidence_digest":null},"runtime_acceptance":{"status":"blocked","evidence_digest":null}}},
    {"action_id":"sprint","source_action_id":"sprint","native_definition":null,"readiness":{"backend":{"status":"candidate","evidence_digest":null},"animation":{"status":"candidate","evidence_digest":null},"object_state":{"status":"not_applicable","evidence_digest":null},"event_mapping":{"status":"blocked","evidence_digest":null},"runtime_acceptance":{"status":"blocked","evidence_digest":null}}},
    {"action_id":"turn_in_place","source_action_id":"turn_in_place","native_definition":null,"readiness":{"backend":{"status":"candidate","evidence_digest":null},"animation":{"status":"blocked","evidence_digest":null},"object_state":{"status":"not_applicable","evidence_digest":null},"event_mapping":{"status":"blocked","evidence_digest":null},"runtime_acceptance":{"status":"blocked","evidence_digest":null}}},
    {"action_id":"crouch","source_action_id":"crouch","native_definition":null,"readiness":{"backend":{"status":"candidate","evidence_digest":null},"animation":{"status":"blocked","evidence_digest":null},"object_state":{"status":"not_applicable","evidence_digest":null},"event_mapping":{"status":"blocked","evidence_digest":null},"runtime_acceptance":{"status":"blocked","evidence_digest":null}}},
    {"action_id":"look_at","source_action_id":"look_at","native_definition":null,"readiness":{"backend":{"status":"candidate","evidence_digest":null},"animation":{"status":"blocked","evidence_digest":null},"object_state":{"status":"not_applicable","evidence_digest":null},"event_mapping":{"status":"candidate","evidence_digest":null},"runtime_acceptance":{"status":"blocked","evidence_digest":null}}},
    {"action_id":"inspect","source_action_id":"inspect","native_definition":null,"readiness":{"backend":{"status":"candidate","evidence_digest":null},"animation":{"status":"candidate","evidence_digest":null},"object_state":{"status":"not_applicable","evidence_digest":null},"event_mapping":{"status":"candidate","evidence_digest":null},"runtime_acceptance":{"status":"blocked","evidence_digest":null}}},
    {"action_id":"pause","source_action_id":"pause","native_definition":null,"readiness":{"backend":{"status":"candidate","evidence_digest":null},"animation":{"status":"blocked","evidence_digest":null},"object_state":{"status":"not_applicable","evidence_digest":null},"event_mapping":{"status":"candidate","evidence_digest":null},"runtime_acceptance":{"status":"blocked","evidence_digest":null}}},
    {"action_id":"pick_up","source_action_id":"pick_up","native_definition":null,"readiness":{"backend":{"status":"candidate","evidence_digest":null},"animation":{"status":"candidate","evidence_digest":null},"object_state":{"status":"candidate","evidence_digest":null},"event_mapping":{"status":"candidate","evidence_digest":null},"runtime_acceptance":{"status":"blocked","evidence_digest":null}}},
    {"action_id":"carry","source_action_id":"carry","native_definition":null,"readiness":{"backend":{"status":"blocked","evidence_digest":null},"animation":{"status":"blocked","evidence_digest":null},"object_state":{"status":"not_applicable","evidence_digest":null},"event_mapping":{"status":"blocked","evidence_digest":null},"runtime_acceptance":{"status":"blocked","evidence_digest":null}}},
    {"action_id":"place","source_action_id":"place","native_definition":null,"readiness":{"backend":{"status":"candidate","evidence_digest":null},"animation":{"status":"candidate","evidence_digest":null},"object_state":{"status":"candidate","evidence_digest":null},"event_mapping":{"status":"candidate","evidence_digest":null},"runtime_acceptance":{"status":"blocked","evidence_digest":null}}},
    {"action_id":"drop","source_action_id":"drop","native_definition":null,"readiness":{"backend":{"status":"candidate","evidence_digest":null},"animation":{"status":"blocked","evidence_digest":null},"object_state":{"status":"candidate","evidence_digest":null},"event_mapping":{"status":"candidate","evidence_digest":null},"runtime_acceptance":{"status":"blocked","evidence_digest":null}}},
    {"action_id":"insert","source_action_id":"insert","native_definition":null,"readiness":{"backend":{"status":"blocked","evidence_digest":null},"animation":{"status":"blocked","evidence_digest":null},"object_state":{"status":"blocked","evidence_digest":null},"event_mapping":{"status":"blocked","evidence_digest":null},"runtime_acceptance":{"status":"blocked","evidence_digest":null}}},
    {"action_id":"pour","source_action_id":"pour","native_definition":null,"readiness":{"backend":{"status":"blocked","evidence_digest":null},"animation":{"status":"blocked","evidence_digest":null},"object_state":{"status":"blocked","evidence_digest":null},"event_mapping":{"status":"blocked","evidence_digest":null},"runtime_acceptance":{"status":"blocked","evidence_digest":null}}},
    {"action_id":"push","source_action_id":"push","native_definition":null,"readiness":{"backend":{"status":"blocked","evidence_digest":null},"animation":{"status":"blocked","evidence_digest":null},"object_state":{"status":"blocked","evidence_digest":null},"event_mapping":{"status":"blocked","evidence_digest":null},"runtime_acceptance":{"status":"blocked","evidence_digest":null}}},
    {"action_id":"pull_drag","source_action_id":"pull_drag","native_definition":null,"readiness":{"backend":{"status":"blocked","evidence_digest":null},"animation":{"status":"blocked","evidence_digest":null},"object_state":{"status":"blocked","evidence_digest":null},"event_mapping":{"status":"blocked","evidence_digest":null},"runtime_acceptance":{"status":"blocked","evidence_digest":null}}},
    {"action_id":"equip","source_action_id":"equip","native_definition":null,"readiness":{"backend":{"status":"blocked","evidence_digest":null},"animation":{"status":"blocked","evidence_digest":null},"object_state":{"status":"blocked","evidence_digest":null},"event_mapping":{"status":"blocked","evidence_digest":null},"runtime_acceptance":{"status":"blocked","evidence_digest":null}}},
    {"action_id":"articulation.open","source_action_id":"articulation.open","native_definition":null,"readiness":{"backend":{"status":"candidate","evidence_digest":null},"animation":{"status":"candidate","evidence_digest":null},"object_state":{"status":"candidate","evidence_digest":null},"event_mapping":{"status":"blocked","evidence_digest":null},"runtime_acceptance":{"status":"blocked","evidence_digest":null}}},
    {"action_id":"close","source_action_id":"close","native_definition":null,"readiness":{"backend":{"status":"candidate","evidence_digest":null},"animation":{"status":"candidate","evidence_digest":null},"object_state":{"status":"candidate","evidence_digest":null},"event_mapping":{"status":"blocked","evidence_digest":null},"runtime_acceptance":{"status":"blocked","evidence_digest":null}}},
    {"action_id":"appliance.toggle_rotary","source_action_id":"appliance.toggle_rotary","native_definition":null,"readiness":{"backend":{"status":"candidate","evidence_digest":null},"animation":{"status":"blocked","evidence_digest":null},"object_state":{"status":"candidate","evidence_digest":null},"event_mapping":{"status":"blocked","evidence_digest":null},"runtime_acceptance":{"status":"blocked","evidence_digest":null}}},